{
  "$schema": "http://json-schema.org/draft-07/schema#",
  "title": "N3xusIQ Inquiry",
  "description": "Schema for contact form inquiries sent to SparkJar Crew API",
  "type": "object",
  "required": [
    "api_key",
    "inquiry_type",
    "contact",
    "message",
    "metadata"
  ],
  "properties": {
    "api_key": {
      "type": "string",
      "description": "SparkJar API key for authentication",
      "minLength": 1
    },
    "inquiry_type": {
      "type": "string",
      "description": "Type of inquiry",
      "enum": ["contact_form", "demo_request", "early_access"]
    },
    "contact": {
      "type": "object",
      "description": "Contact information",
      "required": ["name", "email"],
      "properties": {
        "name": {
          "type": "string",
          "description": "Full name of the person",
          "minLength": 1
        },
        "email": {
          "type": "string",
          "description": "Email address",
          "format": "email"
        },
        "company": {
          "type": "string",
          "description": "Company name (optional)"
        },
        "phone": {
          "type": "string",
          "description": "Phone number (optional)"
        }
      }
    },
    "message": {
      "type": "string",
      "description": "The inquiry message",
      "minLength": 1
    },
    "metadata": {
      "type": "object",
      "description": "Additional metadata about the inquiry",
      "required": ["source_site", "source_locale", "timestamp"],
      "properties": {
        "source_site": {
          "type": "string",
          "description": "Which site the inquiry came from",
          "enum": ["n3xusiq.com", "n3xusiq.mx"]
        },
        "source_locale": {
          "type": "string",
          "description": "Locale of the source site",
          "enum": ["en_US", "es_MX"]
        },
        "timestamp": {
          "type": "string",
          "description": "ISO 8601 timestamp of submission",
          "format": "date-time"
        },
        "user_agent": {
          "type": "string",
          "description": "Browser user agent"
        },
        "ip_address": {
          "type": "string",
          "description": "Client IP address"
        },
        "referrer": {
          "type": "string",
          "description": "HTTP referrer if available"
        }
      }
    }
  }
}