{
  "api_key": "f3a9d2e6b7c81f4d5a2e36b9c4f8a1d0e7b5c3a2f9d4e6b1c8a3e5f7b2d4c6a",
  "inquiry_type": "contact_form",
  "contact": {
    "name": "Mike Williams",
    "email": "mike@unrivaled.com",
    "company": "unrivaled llc",
    "phone": ""
  },
  "message": "my company is named unrivaled llc i am interested in your knowledge graph",
  "metadata": {
    "source_site": "n3xusiq.com",
    "source_locale": "en_US",
    "timestamp": "2025-07-12T16:28:08Z",
    "user_agent": "Mozilla/5.0 (Macintosh; Intel Mac OS X 10_15_7) AppleWebKit/537.36 (KHTML, like Gecko) Chrome/120.0.0.0 Safari/537.36",
    "ip_address": "192.168.1.100",
    "referrer": "https://n3xusiq.com/#about"
  }
}